<?xml version="1.0" encoding="utf-8" ?>
<!--
  <auto-generated>
    Este código fue generado por OurCode 1.0.0.1

    Código escrito por Martin Daza
    Fecha: 21-ene-2014 08:48

    Los cambios en este archivo podrían causar un comportamiento incorrecto
    y se perderán si se vuelve a generar el código.
  </auto-generated>
-->
<transacciones xmlns:xsi="http://www.w3.org/2001/XMLSchema-instance"
    xsi:noNamespaceSchemaLocation="file:./MapaTransaciones.xsd">
  <proveedor id="ActivosFijos">
    <tipodestino>ConectorDB</tipodestino>
    <TipoProveedor>Sql</TipoProveedor>
    <CadenaConexion>Data Source=192.168.0.25\SQLWIN_SRV01;Initial Catalog=dlp_WMActivosFijos;User Id=Usr_dlp_WMActivosFijos;Password=Pas_dlp_WMActivosFijos</CadenaConexion>
  </proveedor>
  <!-- ObtenerActivo -->
  <transaccion codigo="5" operacion="Obtener" Evento="1">
    <destino>
      <conexion>ActivosFijos</conexion>
      <tiempoespera>60</tiempoespera>
      <reintentos>1</reintentos>
      <tiemporeintento>10</tiemporeintento>
      <esobjeto>true</esobjeto>
      <persiste>true</persiste>
    </destino>
  </transaccion>
  <!-- ObtenerFechaHora -->
  <transaccion codigo="1" operacion="Obtener" Evento="1">
    <destino>
      <conexion>ActivosFijos</conexion>
      <tiempoespera>60</tiempoespera>
      <reintentos>1</reintentos>
      <tiemporeintento>10</tiemporeintento>
      <esobjeto>true</esobjeto>
      <persiste>true</persiste>
    </destino>
  </transaccion>
  <!-- ObtenerLista -->
  <transaccion codigo="7" operacion="Obtener" Evento="1">
    <destino>
      <conexion>ActivosFijos</conexion>
      <tiempoespera>60</tiempoespera>
      <reintentos>1</reintentos>
      <tiemporeintento>10</tiemporeintento>
      <esobjeto>true</esobjeto>
      <persiste>true</persiste>
    </destino>
  </transaccion>
  <!-- ObtenerListaEditable -->
  <transaccion codigo="6" operacion="Obtener" Evento="1">
    <destino>
      <conexion>ActivosFijos</conexion>
      <tiempoespera>60</tiempoespera>
      <reintentos>1</reintentos>
      <tiemporeintento>10</tiemporeintento>
      <esobjeto>true</esobjeto>
      <persiste>true</persiste>
    </destino>
  </transaccion>
  <!-- ObtenerLogin -->
  <transaccion codigo="2" operacion="Obtener" Evento="1">
    <destino>
      <conexion>ActivosFijos</conexion>
      <tiempoespera>60</tiempoespera>
      <reintentos>1</reintentos>
      <tiemporeintento>10</tiemporeintento>
      <esobjeto>true</esobjeto>
      <persiste>true</persiste>
    </destino>
  </transaccion>
  <!-- ObtenerRolFuncion -->
  <transaccion codigo="4" operacion="Obtener" Evento="1">
    <destino>
      <conexion>ActivosFijos</conexion>
      <tiempoespera>60</tiempoespera>
      <reintentos>1</reintentos>
      <tiemporeintento>10</tiemporeintento>
      <esobjeto>true</esobjeto>
      <persiste>true</persiste>
    </destino>
  </transaccion>
  <!-- ObtenerUsuario -->
  <transaccion codigo="11" operacion="Obtener" Evento="1">
    <destino>
      <conexion>ActivosFijos</conexion>
      <tiempoespera>60</tiempoespera>
      <reintentos>1</reintentos>
      <tiemporeintento>10</tiemporeintento>
      <esobjeto>true</esobjeto>
      <persiste>true</persiste>
    </destino>
  </transaccion>
  <!-- ObtenerUsuarioRol -->
  <transaccion codigo="3" operacion="Obtener" Evento="1">
    <destino>
      <conexion>ActivosFijos</conexion>
      <tiempoespera>60</tiempoespera>
      <reintentos>1</reintentos>
      <tiemporeintento>10</tiemporeintento>
      <esobjeto>true</esobjeto>
      <persiste>true</persiste>
    </destino>
  </transaccion>
  <!-- RegistrarActivoEjecutado -->
  <transaccion codigo="8" operacion="Registrar" Evento="1">
    <destino>
      <conexion>ActivosFijos</conexion>
      <tiempoespera>60</tiempoespera>
      <reintentos>1</reintentos>
      <tiemporeintento>10</tiemporeintento>
      <esobjeto>true</esobjeto>
      <persiste>true</persiste>
    </destino>
  </transaccion>
  <!-- RegistrarListaEditableEjecutada -->
  <transaccion codigo="9" operacion="Registrar" Evento="1">
    <destino>
      <conexion>ActivosFijos</conexion>
      <tiempoespera>60</tiempoespera>
      <reintentos>1</reintentos>
      <tiemporeintento>10</tiemporeintento>
      <esobjeto>true</esobjeto>
      <persiste>true</persiste>
    </destino>
  </transaccion>
  <!-- RegistrarLogTransaccionesAct -->
  <transaccion codigo="10" operacion="Registrar" Evento="1">
    <destino>
      <conexion>ActivosFijos</conexion>
      <tiempoespera>60</tiempoespera>
      <reintentos>1</reintentos>
      <tiemporeintento>10</tiemporeintento>
      <esobjeto>true</esobjeto>
      <persiste>true</persiste>
    </destino>
  </transaccion>
</transacciones>
